{
  "schema_version": 1,
  "name": "windows-native",
  "display_name": "Windows Native",
  "author": "Microsoft (system sounds)",
  "description": "Uses Windows system sounds -- zero additional files needed.",
  "mode": "system",
  "platform": ["windows"],
  "sounds": [
    {"file": "C:/Windows/Media/chimes.wav", "name": "Chimes"},
    {"file": "C:/Windows/Media/chord.wav", "name": "Chord"},
    {"file": "C:/Windows/Media/ding.wav", "name": "The Classic"},
    {"file": "C:/Windows/Media/notify.wav", "name": "Notify"},
    {"file": "C:/Windows/Media/tada.wav", "name": "Fanfare"},
    {"file": "C:/Windows/Media/ringout.wav", "name": "Ring Out"},
    {"file": "C:/Windows/Media/recycle.wav", "name": "Recycle"},
    {"file": "C:/Windows/Media/Alarm01.wav", "name": "Dawn"},
    {"file": "C:/Windows/Media/Alarm02.wav", "name": "Daybreak"},
    {"file": "C:/Windows/Media/Alarm03.wav", "name": "First Light"},
    {"file": "C:/Windows/Media/Alarm04.wav", "name": "Reveille"},
    {"file": "C:/Windows/Media/Alarm05.wav", "name": "Wake Up"},
    {"file": "C:/Windows/Media/Alarm06.wav", "name": "Rise"},
    {"file": "C:/Windows/Media/Ring01.wav", "name": "Bell One"},
    {"file": "C:/Windows/Media/Ring02.wav", "name": "Bell Two"},
    {"file": "C:/Windows/Media/Ring03.wav", "name": "Bell Three"},
    {"file": "C:/Windows/Media/Ring04.wav", "name": "Bell Four"},
    {"file": "C:/Windows/Media/Ring05.wav", "name": "Bell Five"},
    {"file": "C:/Windows/Media/Ring06.wav", "name": "Bell Six"},
    {"file": "C:/Windows/Media/Windows Balloon.wav", "name": "Balloon"},
    {"file": "C:/Windows/Media/Windows Feed Discovered.wav", "name": "Discovery"},
    {"file": "C:/Windows/Media/Windows Hardware Insert.wav", "name": "Connected"},
    {"file": "C:/Windows/Media/Windows Notify Calendar.wav", "name": "Calendar"},
    {"file": "C:/Windows/Media/Windows Notify Email.wav", "name": "Inbox"},
    {"file": "C:/Windows/Media/Windows Print complete.wav", "name": "Complete"}
  ],
  "events": {
    "error": {"file": "C:/Windows/Media/Windows Critical Stop.wav", "name": "Critical Stop"},
    "approval": {"file": "C:/Windows/Media/Windows Exclamation.wav", "name": "Exclamation"},
    "end": {"file": "C:/Windows/Media/Windows Logoff Sound.wav", "name": "Logoff"}
  }
}
