{
  "schema_version": 1,
  "name": "Retro Arcade",
  "author": "community",
  "description": "Classic arcade and retro game sounds. Recipe mode -- source your own WAV files and drop them into this pack directory.",
  "category": "game",
  "platform": ["windows", "darwin", "linux"],
  "mode": "recipe",
  "sounds": [
    {"file": "coin_insert.wav", "name": "Insert Coin"},
    {"file": "extra_life.wav", "name": "Extra Life"},
    {"file": "game_over.wav", "name": "Game Over"},
    {"file": "high_score.wav", "name": "High Score"},
    {"file": "level_up.wav", "name": "Level Up"},
    {"file": "power_pellet.wav", "name": "Power Pellet"},
    {"file": "question_block.wav", "name": "Question Block"},
    {"file": "secret_found.wav", "name": "Secret Found"},
    {"file": "shield_up.wav", "name": "Shield Up"},
    {"file": "speed_boost.wav", "name": "Speed Boost"},
    {"file": "stage_clear.wav", "name": "Stage Clear"},
    {"file": "warp_zone.wav", "name": "Warp Zone"}
  ]
}
