{
  "schema_version": 1,
  "name": "Default",
  "author": "session-sounds",
  "description": "The bundled CC0 session sounds. Ships with the installer.",
  "category": "mixed",
  "platform": ["windows", "darwin", "linux"],
  "mode": "bundled",
  "sounds": [
    {"file": "abouttime.wav", "name": "About Time"},
    {"file": "africa.wav", "name": "Africa"},
    {"file": "bond.wav", "name": "007"},
    {"file": "civ.wav", "name": "New Era"},
    {"file": "coolcat.wav", "name": "Cool Cat"},
    {"file": "creek.wav", "name": "Bluey Creek"},
    {"file": "dangerzone.wav", "name": "Danger Zone"},
    {"file": "gladiator.wav", "name": "Elysium"},
    {"file": "indy.wav", "name": "Indy"},
    {"file": "jurassic.wav", "name": "Life Finds a Way"},
    {"file": "lightsaber.wav", "name": "Lightsaber"},
    {"file": "mangione.wav", "name": "Feels So Good"},
    {"file": "mario_powerup.wav", "name": "Mario Mushroom"},
    {"file": "minecraft.wav", "name": "Minecraft"},
    {"file": "mission.wav", "name": "IMF"},
    {"file": "mohican.wav", "name": "Mohican"},
    {"file": "pacman.wav", "name": "Waka Waka"},
    {"file": "pentakill.wav", "name": "Pentakill"},
    {"file": "pokeball.wav", "name": "Gotcha"},
    {"file": "potg.wav", "name": "POTG"},
    {"file": "r2d2.wav", "name": "R2-D2"},
    {"file": "scorpion.wav", "name": "Scorpion"},
    {"file": "shire.wav", "name": "The Shire"},
    {"file": "takeonme.wav", "name": "Take On Me"},
    {"file": "tetris.wav", "name": "Tetris"}
  ]
}
